A1: MiWi Stack for PIC18, PIC24, dsPIC30, and dsPIC33
A3: Revision: v1.0 | C3: 39092
A5: Changes
A6: (1) | B6: Initial Revision
A8: Features
B9: EUI Address Search Support
B10: Cluster Socket Support
B11: Peer to Peer Socket Support
B12: Security Support
A14: Limitations
A15: (1) | B15: No POR failure recovery mechanism is provided. NetworkTables, sockets, node, and parent information is lost on a power failure unless the application saves and restores them.
A16: (2) | B16: R22 must be moved to R21 for use with Explorer 16 for Revision 4 or earlier of AC163027-4.
A17: Requirements
C18: Coordinator | E18: End Device | G18: Notes
C19: C18 | D19: C30 | E19: C18 | F19: C30
B20: Flash Requirements
B21: Base Stack | C21: 8829 | D21: 9630 | E21: 5841 | F21: 6927 | G21: (1)
B22: Demo | C22: 1320 | D22: 0 | E22: 1570 | F22: 0
B23: EUI Address Search | C23: 600 | D23: 687 | E23: 350 | F23: 390
B24: Cluster Sockets | C24: 850 | D24: 966 | E24: 414 | F24: 375
B25: P2P Sockets | C25: 784 | D25: 921 | E25: 304 | F25: 372
B26: Security | C26: 3052 | D26: 1779 | E26: 3134 | F26: 1725
B27: Total | C27: =SUM(C21:C26) -> 15435 | D27: =SUM(D21:D26) -> 13983 | E27: =SUM(E21:E26) -> 11613 | F27: =SUM(F21:F26) -> 9789
B29: RAM Requirements
B30: Base Stack | C30: 694 | D30: 442 | E30: 720 | F30: 468 | G30: (2)(3)
B31: Demo | C31: 19 | D31: 19 | E31: 19 | F31: 19
B32: EUI Address Search | C32: 0 | D32: 0 | E32: 0 | F32: 0
B33: Cluster Sockets | C33: 0 | D33: 0 | E33: 0 | F33: 0
B34: P2P Sockets | C34: 0 | D34: 0 | E34: 0 | F34: 0
B35: Security | C35: 88 | D35: 88 | E35: 88 | F35: 88
B36: Total | C36: =SUM(C30:C35) -> 801 | D36: =SUM(D30:D35) -> 549 | E36: =SUM(E30:E35) -> 827 | F36: =SUM(F30:F35) -> 575
B38: (1) - for C30 demo and base stack included in the base stack calculation
B39: (2) - for C18 base stack ram includes the C18 stack (256 bytes)
B40: (3) - is largely dependent on the defined NetworkTable size and the Tx and Rx buffer sizes